Uuid,Privilege name,Description,_order:1000
72f1d9c4-b7a5-4fc7-9cfd-5ecb50d4ab1e,View Surgery and Anesthesia,Able to view surgery and anesthesia data,
e2a5b475-cc41-4435-9ec7-c095095ce588,Edit Surgery and Anesthesia,Able to view and edit surgery and anesthesia data,
1dbb4841-d20c-4125-919e-72d40798a3ac,View Pre-Donation,Able to view pre-donation data,
b67f16ac-d358-4ee0-ada2-6c284cd5cf20,Edit Pre-Donation,Able to view and edit pre-donation data,
d15ae765-f176-45fe-b132-d1d5fc86e475,View Blood Transfusion,Able to view blood transfusion data
f973fc49-a518-4162-9e5c-282682d9ca59,Edit Blood Transfusion,Able to view and edit blood transfusion data
64218cf6-af9c-4db9-9a5d-4b6d711b89ec,View Small Procedure Report,Able to view small procedure report data
5708dbd9-32b0-4be9-be36-29691c9e689c,Edit Small Procedure Report,Able to view and edit small procedure report data
54c046d8-6ff2-40ea-9a25-f326e6d7433b,View Wound Dressing,Able to view wound dressing data
5202e956-8868-4428-823b-a5f35ffae17f,Edit Wound Dressing,Able to view and edit wound dressing data
27625cab-9330-4c47-8589-948a8569e961,View Radiology Request,Able to view radiology request data
93b6dbb8-a8c5-43b3-a52b-289273990c47,Edit Radiology Request,Able to view and edit radiology request data
