Uuid,Void/Retire,Name,Description,View privilege,Edit privilege,_order:1000
7b68d557-85ef-4fc8-b767-4fa4f5eb5c23,,Intra-Hospital Transfer,Indicates that a patient is being transferred into a different department within the hospital. (Transfers out of the hospital should not use this encounter type.),,,
36db5123-0ad5-41c0-9037-625b46e0ceef,,Mental Health Assessment,Mental Health Assessment,,,
d3b07384-8d1c-4e6b-9b8e-2f3b8e4a1c9f,,Transfer,Indicates that a patient is being transferred into a different department within the hospital. (Transfers out of the hospital should not use this encounter type.),,,
a1f5c3d2-4b6e-4e8a-9f2d-1b3e8e4a2d7f,,Inpatient Note,A short free-text note written by a clinician about an inpatient during their stay,,,
b2c4d5e6-7f8a-4e9b-8c1d-2e3f8e4a3b8f,,Transfer Request,A stand-alone encounter type for a transfer request not part of a larger note,,,
f47ac10b-58cc-4372-a567-0e02b2c3d479,,Bed Assignment,Assigning a new bed to a patient without admitting or transferring them,,,
550e8400-e29b-41d4-a716-446655440000,,Cancel ADT,An encounter that notes that a request to admit/transfer/discharge a patient is being overridden,,,